SQL> 
SQL> -- Enter code below.
SQL> -- ------------------------------------------------------------------
SQL> -- Step #1
SQL> -- ------------------------------------------------------------------
SQL> COL system_user_id FORMAT 9999 HEADING "System|User|ID #"
SQL> 
SQL> SELECT
  2    system_user_id
  3  FROM system_user
  4  WHERE system_user_name = 'DBA1';

System                                                                          
  User                                                                          
  ID #                                                                          
------                                                                          
  1001                                                                          

1 row selected.

SQL> 
SQL> -- ------------------------------------------------------------------
SQL> -- Step #2
SQL> -- ------------------------------------------------------------------
SQL> COL system_user_id   FORMAT 9999 HEADING "System|User|ID #"
SQL> COL system_user_name FORMAT A20  HEADING "System|User|Name"
SQL> 
SQL> SELECT
  2    system_user_id
  3  , system_user_name
  4  FROM system_user
  5  WHERE system_user_name = 'DBA1';

System System                                                                   
  User User                                                                     
  ID # Name                                                                     
------ --------------------                                                     
  1001 DBA1                                                                     

1 row selected.

SQL> 
SQL> -- ------------------------------------------------------------------
SQL> -- Step #3
SQL> -- ------------------------------------------------------------------
SQL> COL system_user_id1   FORMAT 9999 HEADING "System User|ID #"
SQL> COL system_user_name1 FORMAT A12  HEADING "System User|Name"
SQL> COL system_user_id2   FORMAT 9999 HEADING "Created By|System User|ID #"
SQL> COL system_user_name2 FORMAT A12  HEADING "Created By|System User|Name"
SQL> 
SQL> SELECT
  2    su1.system_user_id AS system_user_id1
  3  , su1.system_user_name AS system_user_name1
  4  , su2.system_user_id AS system_user_id2
  5  , su2.system_user_name AS system_user_name2
  6  FROM system_user su1
  7    JOIN system_user su2
  8  	 ON su1.created_by = su2.system_user_id
  9  WHERE su1.system_user_name = 'DBA1';

                          Created By Created By                                 
System User System User  System User System User                                
       ID # Name                ID # Name                                       
----------- ------------ ----------- ------------                               
       1001 DBA1                   1 SYSADMIN                                   

1 row selected.

SQL> 
SQL> -- ------------------------------------------------------------------
SQL> -- Step #4
SQL> -- ------------------------------------------------------------------
SQL> COL system_user_id1   FORMAT 9999 HEADING "System User|ID #"
SQL> COL system_user_name1 FORMAT A12  HEADING "System User|Name"
SQL> COL system_user_id2   FORMAT 9999 HEADING "Created By|System User|ID #"
SQL> COL system_user_name2 FORMAT A12  HEADING "Created By|System User|Name"
SQL> COL system_user_id3   FORMAT 9999 HEADING "Last|Updated By|System User|ID #"
SQL> COL system_user_name3 FORMAT A12  HEADING "Last|Updated By|System User|Name"
SQL> 
SQL> SELECT
  2    su1.system_user_id AS system_user_id1
  3  , su1.system_user_name AS system_user_name1
  4  , su2.system_user_id AS system_user_id2
  5  , su2.system_user_name AS system_user_name2
  6  , su3.system_user_id AS system_user_id3
  7  , su3.system_user_name AS system_user_name3
  8  FROM system_user su1
  9    JOIN system_user su2
 10  	 ON su1.created_by = su2.system_user_id
 11    JOIN system_user su3
 12  	 ON su1.last_updated_by = su3.system_user_id
 13  WHERE su1.system_user_name = 'DBA1';

                                                         Last Last              
                          Created By Created By    Updated By Updated By        
System User System User  System User System User  System User System User       
       ID # Name                ID # Name                ID # Name              
----------- ------------ ----------- ------------ ----------- ------------      
       1001 DBA1                   1 SYSADMIN               1 SYSADMIN          

1 row selected.

SQL> 
SQL> -- ------------------------------------------------------------------
SQL> -- Step #5
SQL> -- ------------------------------------------------------------------
SQL> COL system_user_id1   FORMAT 9999 HEADING "System User|ID #"
SQL> COL system_user_name1 FORMAT A12  HEADING "System User|Name"
SQL> COL system_user_id2   FORMAT 9999 HEADING "Created By|System User|ID #"
SQL> COL system_user_name2 FORMAT A12  HEADING "Created By|System User|Name"
SQL> COL system_user_id3   FORMAT 9999 HEADING "Last|Updated By|System User|ID #"
SQL> COL system_user_name3 FORMAT A12  HEADING "Last|Updated By|System User|Name"
SQL> 
SQL> SELECT
  2    su1.system_user_id AS system_user_id1
  3  , su1.system_user_name AS system_user_name1
  4  , su2.system_user_id AS system_user_id2
  5  , su2.system_user_name AS system_user_name2
  6  , su3.system_user_id AS system_user_id3
  7  , su3.system_user_name AS system_user_name3
  8  FROM system_user su1
  9    JOIN system_user su2
 10  	 ON su1.created_by = su2.system_user_id
 11    JOIN system_user su3
 12  	 ON su1.last_updated_by = su3.system_user_id;

                                                         Last Last              
                          Created By Created By    Updated By Updated By        
System User System User  System User System User  System User System User       
       ID # Name                ID # Name                ID # Name              
----------- ------------ ----------- ------------ ----------- ------------      
          1 SYSADMIN               1 SYSADMIN               1 SYSADMIN          
       1001 DBA1                   1 SYSADMIN               1 SYSADMIN          
       1002 DBA2                   1 SYSADMIN               1 SYSADMIN          

3 rows selected.

SQL> 
SQL> -- ------------------------------------------------------------------
SQL> -- Step #6
SQL> -- ------------------------------------------------------------------
SQL> @tools/drop_rating_agency.sql
SQL> 
SQL> 
SQL>  -- ------------------------------------------------------------------
SQL> --  Create and assign bind variable for table name.
SQL> -- ------------------------------------------------------------------
SQL> VARIABLE table_name     VARCHAR2(30)
SQL> 
SQL> BEGIN
  2    :table_name := UPPER('rating_agency');
  3  END;
  4  /

PL/SQL procedure successfully completed.

SQL> 
SQL> 
SQL> -- ------------------------------------------------------------------
SQL> --  Conditionally drop table.
SQL> -- ------------------------------------------------------------------
SQL> DECLARE
  2    CURSOR c (cv_object_name VARCHAR2) IS
  3  	 SELECT o.object_type
  4  	 ,	o.object_name
  5  	 FROM	user_objects o
  6  	 WHERE	o.object_name LIKE UPPER(cv_object_name||'%');
  7  BEGIN
  8    FOR i IN c(:table_name) LOOP
  9  	 IF i.object_type = 'SEQUENCE' THEN
 10  	   EXECUTE IMMEDIATE 'DROP '||i.object_type||' '||i.object_name;
 11  	 ELSIF i.object_type = 'TABLE' THEN
 12  	   EXECUTE IMMEDIATE 'DROP '||i.object_type||' '||i.object_name||' CASCADE CONSTRAINTS';
 13  	 END IF;
 14    END LOOP;
 15  END;
 16  /

PL/SQL procedure successfully completed.

SQL> 
SQL> CREATE TABLE rating_agency
  2  (
  3    rating_agency_id   NUMBER
  4  , rating_agency_abbr VARCHAR2(4)  CONSTRAINT nn_rating_agency_1 NOT NULL
  5  , rating_agency_name VARCHAR2(40) CONSTRAINT nn_rating_agency_2 NOT NULL
  6  , created_by		NUMBER CONSTRAINT nn_rating_agency_3 NOT NULL
  7  , creation_date		DATE   CONSTRAINT nn_rating_agency_4 NOT NULL
  8  , last_updated_by		NUMBER CONSTRAINT nn_rating_agency_5 NOT NULL
  9  , last_update_date 	DATE   CONSTRAINT nn_rating_agency_6 NOT NULL
 10  , CONSTRAINT pk_rating_agency   PRIMARY KEY (rating_agency_id)
 11  , CONSTRAINT uq_rating_agency   UNIQUE (rating_agency_abbr)
 12  , CONSTRAINT fk_rating_agency_1 FOREIGN KEY (created_by)	   REFERENCES system_user(system_user_id)
 13  , CONSTRAINT fk_rating_agency_2 FOREIGN KEY (last_updated_by) REFERENCES system_user(system_user_id)
 14  );

Table created.

SQL> 
SQL> DROP SEQUENCE rating_agency_s1;
DROP SEQUENCE rating_agency_s1
              *
ERROR at line 1:
ORA-02289: sequence does not exist 


SQL> 
SQL> CREATE SEQUENCE rating_agency_s1
  2  START WITH      1001
  3  INCREMENT BY    1;

Sequence created.

SQL> 
SQL> @tools/verify_rating_agency.sql
SQL> 
SQL> SET NULL ''
SQL> COLUMN table_name	 FORMAT A14
SQL> COLUMN column_id	 FORMAT 9999
SQL> COLUMN column_name  FORMAT A22
SQL> COLUMN data_type	 FORMAT A12
SQL> SELECT   table_name
  2  ,	      column_id
  3  ,	      column_name
  4  ,	      CASE
  5  		WHEN nullable = 'N' THEN 'NOT NULL'
  6  		ELSE ''
  7  	      END AS nullable
  8  ,	      CASE
  9  		WHEN data_type IN ('CHAR','VARCHAR2','NUMBER') THEN
 10  		  data_type||'('||data_length||')'
 11  		ELSE
 12  		  data_type
 13  	      END AS data_type
 14  FROM     user_tab_columns
 15  WHERE    table_name = 'RATING_AGENCY'
 16  ORDER BY 2;

                         Column                                                 
Table Name     COLUMN_ID Name                   NULLABLE DATA_TYPE              
-------------- --------- ---------------------- -------- ------------           
RATING_AGENCY          1 RATING_AGENCY_ID       NOT NULL NUMBER(22)             
RATING_AGENCY          2 RATING_AGENCY_ABBR     NOT NULL VARCHAR2(4)            
RATING_AGENCY          3 RATING_AGENCY_NAME     NOT NULL VARCHAR2(40)           
RATING_AGENCY          4 CREATED_BY             NOT NULL NUMBER(22)             
RATING_AGENCY          5 CREATION_DATE          NOT NULL DATE                   
RATING_AGENCY          6 LAST_UPDATED_BY        NOT NULL NUMBER(22)             
RATING_AGENCY          7 LAST_UPDATE_DATE       NOT NULL DATE                   

7 rows selected.

SQL> 
SQL> -- ------------------------------------------------------------------
SQL> -- Step #7
SQL> -- ------------------------------------------------------------------
SQL> INSERT INTO rating_agency
  2  ( rating_agency_id
  3  , rating_agency_abbr
  4  , rating_agency_name
  5  , created_by
  6  , creation_date
  7  , last_updated_by
  8  , last_update_date)
  9  VALUES
 10  ( rating_agency_s1.NEXTVAL
 11  , 'ESRB', 'Entertainment Software Rating Board'
 12  , (SELECT system_user_id FROM system_user WHERE system_user_name = 'DBA2')
 13  , SYSDATE
 14  , (SELECT system_user_id FROM system_user WHERE system_user_name = 'DBA2')
 15  , SYSDATE);

1 row created.

SQL> 
SQL> INSERT INTO rating_agency
  2  ( rating_agency_id
  3  , rating_agency_abbr
  4  , rating_agency_name
  5  , created_by
  6  , creation_date
  7  , last_updated_by
  8  , last_update_date)
  9  VALUES
 10  ( rating_agency_s1.NEXTVAL
 11  , 'MPAA'
 12  , 'Motion Picture Association of America'
 13  , (SELECT system_user_id FROM system_user WHERE system_user_name = 'DBA2')
 14  , SYSDATE
 15  , (SELECT system_user_id FROM system_user WHERE system_user_name = 'DBA2')
 16  , SYSDATE);

1 row created.

SQL> 
SQL> COL rating_agency_id   FORMAT 9999 HEADING "Rating|Agency|ID #"
SQL> COL rating_agency_abbr FORMAT A6	HEADING "Rating|Agency|Abbr"
SQL> COL rating_agency_name FORMAT A40	HEADING "Rating Agency"
SQL> 
SQL> SELECT
  2    rating_agency_id
  3  , rating_agency_abbr
  4  , rating_agency_name
  5  FROM rating_agency;

Rating Rating                                                                   
Agency Agency                                                                   
  ID # Abbr   Rating Agency                                                     
------ ------ ----------------------------------------                          
  1001 ESRB   Entertainment Software Rating Board                               
  1002 MPAA   Motion Picture Association of America                             

2 rows selected.

SQL> 
SQL> -- ------------------------------------------------------------------
SQL> -- Step #8
SQL> -- ------------------------------------------------------------------
SQL> @tools/drop_rating.sql
SQL> 
SQL> 
SQL>  -- ------------------------------------------------------------------
SQL> --  Create and assign bind variable for table name.
SQL> -- ------------------------------------------------------------------
SQL> VARIABLE table_name     VARCHAR2(30)
SQL> 
SQL> BEGIN
  2    :table_name := UPPER('rating');
  3  END;
  4  /

PL/SQL procedure successfully completed.

SQL> 
SQL> 
SQL> -- ------------------------------------------------------------------
SQL> --  Conditionally drop table.
SQL> -- ------------------------------------------------------------------
SQL> DECLARE
  2    CURSOR c (cv_object_name VARCHAR2) IS
  3  	 SELECT o.object_type
  4  	 ,	o.object_name
  5  	 FROM	user_objects o
  6  	 WHERE	o.object_name = UPPER(cv_object_name);
  7  BEGIN
  8    FOR i IN c(:table_name) LOOP
  9  	 IF i.object_type = 'SEQUENCE' THEN
 10  	   EXECUTE IMMEDIATE 'DROP '||i.object_type||' '||i.object_name;
 11  	 ELSIF i.object_type = 'TABLE' THEN
 12  	   EXECUTE IMMEDIATE 'DROP '||i.object_type||' '||i.object_name||' CASCADE CONSTRAINTS';
 13  	 END IF;
 14    END LOOP;
 15  END;
 16  /

PL/SQL procedure successfully completed.

SQL> 
SQL> CREATE TABLE rating
  2  (
  3    rating_id	NUMBER
  4  , rating_agency_id       NUMBER  CONSTRAINT nn_rating_1 NOT NULL
  5  , rating		VARCHAR2(15)  CONSTRAINT nn_rating_2 NOT NULL
  6  , description	VARCHAR2(420) CONSTRAINT nn_rating_3 NOT NULL
  7  , created_by	       NUMBER CONSTRAINT nn_rating_4 NOT NULL
  8  , creation_date		 DATE CONSTRAINT nn_rating_5 NOT NULL
  9  , last_updated_by	       NUMBER CONSTRAINT nn_rating_6 NOT NULL
 10  , last_update_date   VARCHAR(45) CONSTRAINT nn_rating_7 NOT NULL
 11  , CONSTRAINT pk_rating   PRIMARY KEY (rating_id)
 12  , CONSTRAINT uq_rating   UNIQUE (rating)
 13  , CONSTRAINT fk_rating_1 FOREIGN KEY (created_by)	     REFERENCES system_user(system_user_id)
 14  , CONSTRAINT fk_rating_2 FOREIGN KEY (last_updated_by)  REFERENCES system_user(system_user_id)
 15  , CONSTRAINT fk_rating_3 FOREIGN KEY (rating_agency_id) REFERENCES rating_agency(rating_agency_id)
 16  );

Table created.

SQL> 
SQL> DROP SEQUENCE rating_s1;
DROP SEQUENCE rating_s1
              *
ERROR at line 1:
ORA-02289: sequence does not exist 


SQL> 
SQL> CREATE SEQUENCE rating_s1
  2  START WITH      1001
  3  INCREMENT BY    1;

Sequence created.

SQL> 
SQL> @tools/verify_rating.sql
SQL> 
SQL> SET NULL ''
SQL> COLUMN table_name	 FORMAT A14
SQL> COLUMN column_id	 FORMAT 9999
SQL> COLUMN column_name  FORMAT A22
SQL> COLUMN data_type	 FORMAT A12
SQL> SELECT   table_name
  2  ,	      column_id
  3  ,	      column_name
  4  ,	      CASE
  5  		WHEN nullable = 'N' THEN 'NOT NULL'
  6  		ELSE ''
  7  	      END AS nullable
  8  ,	      CASE
  9  		WHEN data_type IN ('CHAR','VARCHAR2','NUMBER') THEN
 10  		  data_type||'('||data_length||')'
 11  		ELSE
 12  		  data_type
 13  	      END AS data_type
 14  FROM     user_tab_columns
 15  WHERE    table_name = 'RATING'
 16  ORDER BY 2;

                         Column                                                 
Table Name     COLUMN_ID Name                   NULLABLE DATA_TYPE              
-------------- --------- ---------------------- -------- ------------           
RATING                 1 RATING_ID              NOT NULL NUMBER(22)             
RATING                 2 RATING_AGENCY_ID       NOT NULL NUMBER(22)             
RATING                 3 RATING                 NOT NULL VARCHAR2(15)           
RATING                 4 DESCRIPTION            NOT NULL VARCHAR2(420           
                                                         )                      
                                                                                
RATING                 5 CREATED_BY             NOT NULL NUMBER(22)             
RATING                 6 CREATION_DATE          NOT NULL DATE                   
RATING                 7 LAST_UPDATED_BY        NOT NULL NUMBER(22)             
RATING                 8 LAST_UPDATE_DATE       NOT NULL VARCHAR2(45)           

8 rows selected.

SQL> @tools/seed_rating.sql
SQL> -- seed_rating.sql
SQL> 
SQL> -- ==================================================================================
SQL> -- MPAA (Movies) Ratings
SQL> -- ==================================================================================
SQL> INSERT INTO rating
  2  (rating_id, rating_agency_id, rating, description, created_by, creation_date,
  3  last_updated_by, last_update_date)
  4  VALUES
  5  (rating_s1.NEXTVAL, (SELECT rating_agency_id FROM rating_agency WHERE
  6  rating_agency_abbr = 'MPAA'), 'G', 'General Audiences', (SELECT system_user_id FROM
  7  system_user WHERE system_user_name = 'DBA2'), SYSDATE, (SELECT system_user_id FROM
  8  system_user WHERE system_user_name = 'DBA2'), SYSDATE);

1 row created.

SQL> 
SQL> INSERT INTO rating
  2  (rating_id, rating_agency_id, rating, description, created_by, creation_date,
  3  last_updated_by, last_update_date)
  4  VALUES
  5  (rating_s1.NEXTVAL, (SELECT rating_agency_id FROM rating_agency WHERE
  6  rating_agency_abbr = 'MPAA'), 'PG', 'Parental Guidance Suggested', (SELECT
  7  system_user_id FROM system_user WHERE system_user_name = 'DBA2'), SYSDATE, (SELECT
  8  system_user_id FROM system_user WHERE system_user_name = 'DBA2'), SYSDATE);

1 row created.

SQL> 
SQL> INSERT INTO rating
  2  (rating_id, rating_agency_id, rating, description, created_by, creation_date,
  3  last_updated_by, last_update_date)
  4  VALUES
  5  (rating_s1.NEXTVAL, (SELECT rating_agency_id FROM rating_agency WHERE
  6  rating_agency_abbr = 'MPAA'), 'PG-13', 'Parental Guidance Strongly Suggested',
  7  (SELECT system_user_id FROM system_user WHERE system_user_name = 'DBA2'), SYSDATE,
  8  (SELECT system_user_id FROM system_user WHERE system_user_name = 'DBA2'), SYSDATE);

1 row created.

SQL> 
SQL> INSERT INTO rating
  2  (rating_id, rating_agency_id, rating, description, created_by, creation_date,
  3  last_updated_by, last_update_date)
  4  VALUES
  5  (rating_s1.NEXTVAL, (SELECT rating_agency_id FROM rating_agency WHERE
  6  rating_agency_abbr = 'MPAA'), 'NC-17', 'No One 17 And Under Admitted', (SELECT
  7  system_user_id FROM system_user WHERE system_user_name = 'DBA2'), SYSDATE, (SELECT
  8  system_user_id FROM system_user WHERE system_user_name = 'DBA2'), SYSDATE);

1 row created.

SQL> 
SQL> INSERT INTO rating
  2  (rating_id, rating_agency_id, rating, description, created_by, creation_date,
  3  last_updated_by, last_update_date)
  4  VALUES
  5  (rating_s1.NEXTVAL, (SELECT rating_agency_id FROM rating_agency WHERE
  6  rating_agency_abbr = 'MPAA'), 'R', 'Restricted', (SELECT system_user_id FROM
  7  system_user WHERE system_user_name = 'DBA2'), SYSDATE, (SELECT system_user_id FROM
  8  system_user WHERE system_user_name = 'DBA2'), SYSDATE);

1 row created.

SQL> 
SQL> INSERT INTO rating
  2  (rating_id, rating_agency_id, rating, description, created_by, creation_date,
  3  last_updated_by, last_update_date)
  4  VALUES
  5  (rating_s1.NEXTVAL, (SELECT rating_agency_id FROM rating_agency WHERE
  6  rating_agency_abbr = 'MPAA'), 'NR', 'Not Rated', (SELECT system_user_id FROM
  7  system_user WHERE system_user_name = 'DBA2'), SYSDATE, (SELECT system_user_id FROM
  8  system_user WHERE system_user_name = 'DBA2'), SYSDATE);

1 row created.

SQL> 
SQL> -- ==================================================================================
SQL> --ESRB RATINGS
SQL> -- ==============================================================================
SQL> INSERT INTO rating
  2  (rating_id, rating_agency_id, rating, description, created_by, creation_date,
  3  last_updated_by, last_update_date)
  4  VALUES
  5  (rating_s1.NEXTVAL, (SELECT rating_agency_id FROM rating_agency WHERE
  6  rating_agency_abbr = 'ESRB'), 'EC', 'Early Childhood', (SELECT system_user_id FROM
  7  system_user WHERE system_user_name = 'DBA2'), SYSDATE, (SELECT system_user_id FROM
  8  system_user WHERE system_user_name = 'DBA2'), SYSDATE);

1 row created.

SQL> 
SQL> INSERT INTO rating
  2  (rating_id, rating_agency_id, rating, description, created_by, creation_date,
  3  last_updated_by, last_update_date)
  4  VALUES
  5  (rating_s1.NEXTVAL, (SELECT rating_agency_id FROM rating_agency WHERE
  6  rating_agency_abbr = 'ESRB'), 'E', 'Everyone', (SELECT system_user_id FROM
  7  system_user WHERE system_user_name = 'DBA2'), SYSDATE, (SELECT system_user_id FROM
  8  system_user WHERE system_user_name = 'DBA2'), SYSDATE);

1 row created.

SQL> 
SQL> INSERT INTO rating
  2  (rating_id, rating_agency_id, rating, description, created_by, creation_date,
  3  last_updated_by, last_update_date)
  4  VALUES
  5  (rating_s1.NEXTVAL, (SELECT rating_agency_id FROM rating_agency WHERE
  6  rating_agency_abbr = 'ESRB'), 'E10+', 'Everyone 10+', (SELECT system_user_id FROM
  7  system_user WHERE system_user_name = 'DBA2'), SYSDATE, (SELECT system_user_id FROM
  8  system_user WHERE system_user_name = 'DBA2'), SYSDATE);

1 row created.

SQL> 
SQL> INSERT INTO rating
  2  (rating_id, rating_agency_id, rating, description, created_by, creation_date,
  3  last_updated_by, last_update_date)
  4  VALUES
  5  (rating_s1.NEXTVAL, (SELECT rating_agency_id FROM rating_agency WHERE
  6  rating_agency_abbr = 'ESRB'), 'T', 'Teen', (SELECT system_user_id FROM system_user
  7  WHERE system_user_name = 'DBA2'), SYSDATE, (SELECT system_user_id FROM system_user
  8  WHERE system_user_name = 'DBA2'), SYSDATE);

1 row created.

SQL> 
SQL> INSERT INTO rating
  2  (rating_id, rating_agency_id, rating, description, created_by, creation_date,
  3  last_updated_by, last_update_date)
  4  VALUES
  5  (rating_s1.NEXTVAL, (SELECT rating_agency_id FROM rating_agency WHERE
  6  rating_agency_abbr = 'ESRB'), 'M', 'Mature', (SELECT system_user_id FROM
  7  system_user WHERE system_user_name = 'DBA2'), SYSDATE, (SELECT system_user_id FROM
  8  system_user WHERE system_user_name = 'DBA2'), SYSDATE);

1 row created.

SQL> 
SQL> INSERT INTO rating
  2  (rating_id, rating_agency_id, rating, description, created_by, creation_date,
  3  last_updated_by, last_update_date)
  4  VALUES
  5  (rating_s1.NEXTVAL, (SELECT rating_agency_id FROM rating_agency WHERE
  6  rating_agency_abbr = 'ESRB'), 'AO', 'Adult Only', (SELECT system_user_id FROM
  7  system_user WHERE system_user_name = 'DBA2'), SYSDATE, (SELECT system_user_id FROM
  8  system_user WHERE system_user_name = 'DBA2'), SYSDATE);

1 row created.

SQL> 
SQL> INSERT INTO rating
  2  (rating_id, rating_agency_id, rating, description, created_by, creation_date,
  3  last_updated_by, last_update_date)
  4  VALUES
  5  (rating_s1.NEXTVAL, (SELECT rating_agency_id FROM rating_agency WHERE
  6  rating_agency_abbr = 'ESRB'), 'RP', 'Rating Pending', (SELECT system_user_id FROM
  7  system_user WHERE system_user_name = 'DBA2'), SYSDATE, (SELECT system_user_id FROM
  8  system_user WHERE system_user_name = 'DBA2'), SYSDATE);

1 row created.

SQL> 
SQL> UPDATE item SET item_rating = 'E'	   where item_rating = 'Everyone';

4 rows updated.

SQL> UPDATE item SET item_rating = 'T'	   where item_rating = 'Teen';

3 rows updated.

SQL> UPDATE item SET item_rating = 'M'	   where item_rating = 'Mature';

1 row updated.

SQL> UPDATE item SET item_rating = 'PG-13' where item_rating = 'PG13';

1 row updated.

SQL> 
SQL> -- ------------------------------------------------------------------
SQL> -- Step #9
SQL> -- ------------------------------------------------------------------
SQL> ALTER TABLE item
  2  ADD rating_id NUMBER
  3  CONSTRAINT fk_item_4 REFERENCES rating(rating_id);

Table altered.

SQL> 
SQL> UPDATE item i
  2  SET i.rating_id =
  3  (
  4  SELECT
  5    r.rating_id
  6  FROM rating r
  7  WHERE r.rating = i.item_rating
  8  );

21 rows updated.

SQL> 
SQL> COL fk	 FORMAT 9999 HEADING "Item|------||Foreign|Key #"
SQL> COL irating FORMAT A15  HEADING "Item|----------||Non-unique|Rating"
SQL> COL counter FORMAT 9999 HEADING "Item|----------|Count|Non-unique|Rating"
SQL> COL pk	 FORMAT 9999 HEADING "Rating|------||Primary|Key #"
SQL> COL pk_abbr FORMAT A6   HEADING "Rating|Agency|------||Unique|Agency"
SQL> COL rating  FORMAT A15  HEADING "Rating|------||Unique|Rating"
SQL> 
SQL> SELECT
  2    i.rating_id AS fk
  3  , i.item_rating AS irating
  4  , COUNT(i.item_rating) AS counter
  5  , r.rating_id AS pk
  6  , ra.rating_agency_abbr AS pk_abbr
  7  , r.rating AS rating
  8  FROM item i
  9    JOIN rating r
 10  	 ON i.rating_id = r.rating_id
 11    JOIN rating_agency ra
 12  	 ON r.rating_agency_id = ra.rating_agency_id
 13  GROUP BY i.rating_id, i.item_rating, r.rating_id, ra.rating_agency_abbr, r.rating
 14  ORDER BY i.rating_id;

                                           Rating                               
   Item Item                  Item  Rating Agency Rating                        
 ------ ----------      ----------  ------ ------ ------                        
                             Count                                              
Foreign Non-unique      Non-unique Primary Unique Unique                        
  Key # Rating              Rating   Key # Agency Rating                        
------- --------------- ---------- ------- ------ ---------------               
   1001 G                        4    1001 MPAA   G                             
   1002 PG                       7    1002 MPAA   PG                            
   1003 PG-13                    1    1003 MPAA   PG-13                         
   1006 NR                       1    1006 MPAA   NR                            
   1008 E                        4    1008 ESRB   E                             
   1010 T                        3    1010 ESRB   T                             
   1011 M                        1    1011 ESRB   M                             

7 rows selected.

SQL> 
SQL> ALTER TABLE item
  2  ADD CONSTRAINT nn_item_12 CHECK(rating_id IS NOT NULL);

Table altered.

SQL> 
SQL> ALTER TABLE item
  2  DROP COLUMN item_rating;

Table altered.

SQL> 
SQL> -- ------------------------------------------------------------------
SQL> -- Step #10
SQL> -- ------------------------------------------------------------------
SQL> COL account_number     FORMAT A10 HEADING "Account|Number"
SQL> COL last_name	    FORMAT A10 HEADING "Last Name"
SQL> COL item_title	    FORMAT A24 HEADING "Item Title"
SQL> COL rating_agency_abbr FORMAT A6  HEADING "Rating|Agency|Abbr"
SQL> COL rating 	    FORMAT A10 HEADING "Rating"
SQL> 
SQL> SELECT
  2    m.account_number
  3  , c.last_name
  4  , i.item_title
  5  , ra.rating_agency_abbr
  6  , r.rating
  7  FROM member m
  8   JOIN contact c
  9  	ON m.member_id = c.member_id
 10   JOIN rental re
 11  	ON c.contact_id = re.customer_id
 12   JOIN rental_item ri
 13  	ON re.rental_id = ri.rental_id
 14   JOIN item i
 15  	ON ri.item_id = i.item_id
 16   JOIN rating r
 17  	ON i.rating_id = r.rating_id
 18   JOIN rating_agency ra
 19  	ON r.rating_agency_id = ra.rating_agency_id;

                                               Rating                           
Account                                        Agency                           
Number     Last Name  Item Title               Abbr   Rating                    
---------- ---------- ------------------------ ------ ----------                
B293-71445 Winn       RoboCop                  ESRB   M                         
B293-71447 Sweeney    Cars                     ESRB   E                         
B293-71446 Vizquel    I Remember Mama          MPAA   NR                        
B293-71446 Vizquel    Star Wars III            MPAA   PG-13                     
B293-71445 Winn       The Hunt for Red October MPAA   PG                        
B293-71446 Vizquel    Star Wars I              MPAA   PG                        
B293-71446 Vizquel    Star Wars II             MPAA   PG                        
B293-71447 Sweeney    Hook                     MPAA   PG                        
B293-71446 Vizquel    Camelot                  MPAA   G                         

9 rows selected.

SQL> 
SQL> -- ------------------------------------------------------------------
SQL> -- Enter lab code above.
SQL> 
SQL> -- Close log file.
SQL> SPOOL OFF
